{"schemaVersion":1,"portOfEntry":{"sourceId":"S03","table":"UKFSR 2024 theme 3, chart data 3_2_2a","title":"Percentage of imports of food, feed and drink (FFD) by volume in the UK by port of entry","unit":"% of UK food, feed and drink imports by volume","years":[2022,2023],"note":"UKFSR 2024 table 3_2_2a groups ports as recorded for food, feed and drink imports (HMRC port of entry). Each group is linked to the DfT statistical port that contains it, for highlighting on the map only; the percentages are never added to DfT tonnages.","groups":[{"label":"Dover/Folkestone/Eurotunnel","locodes":["GBDVR"],"linkNote":"Includes the Channel Tunnel (Folkestone), which is not a seaport in DfT's statistics; linked to Dover.","values":[18.09,17.89]},{"label":"Liverpool","locodes":["GBLIV"],"values":[10.55,10.06]},{"label":"London (inc Tilbury)","locodes":["GBLON"],"linkNote":"DfT's London statistical port includes Tilbury and London Gateway.","values":[6.44,8.91]},{"label":"London Gateway","locodes":["GBLON"],"linkNote":"DfT's London statistical port includes Tilbury and London Gateway.","values":[7.75,8.2]},{"label":"Immingham","locodes":["GBIMM"],"linkNote":"Part of DfT's Grimsby & Immingham statistical port.","values":[6.48,8.09]},{"label":"Felixstowe","locodes":["GBFXT"],"values":[5.7,6.66]},{"label":"Belfast","locodes":["GBBEL"],"values":[3.03,3.38]},{"label":"Hull","locodes":["GBHUL"],"values":[2.67,3.12]},{"label":"Middlesbrough","locodes":["GBMME"],"linkNote":"Part of DfT's Tees & Hartlepool statistical port.","values":[3.24,2.73]},{"label":"Southampton","locodes":["GBSOU"],"values":[2.22,2.58]},{"label":"Harwich International","locodes":["GBHRW"],"linkNote":"Part of DfT's Harwich statistical port.","values":[1.75,1.9]},{"label":"Other recorded ports","locodes":[],"values":[19.38,13.72]},{"label":"No port recorded","locodes":[],"values":[12.71,12.75]}]},"shortStraits":{"sourceId":"S03","table":"UKFSR 2024 theme 3, chart data 3_2_2b","title":"Proportion of the volume of UK food, feed and drink imports recorded as entering the UK at Dover, Dover/Eurotunnel or Eurotunnel (Folkestone), by food group","unit":"% of the food group's import volume","years":[2022,2023],"foods":[{"food":"Dairy","values":[40.47,42.2]},{"food":"Meat","values":[38.25,38.78]},{"food":"Coffee, Tea & Spices","values":[30.14,29.81]},{"food":"Fruit & Veg","values":[27.74,29.03]},{"food":"Misc. Edibles","values":[30.13,28.49]},{"food":"Beverages","values":[19.12,17.91]},{"food":"Sugar","values":[11.93,10.27]},{"food":"Cereals","values":[9.77,9.78]},{"food":"Fish","values":[8.01,6.88]},{"food":"Oils & fats","values":[4.11,4.1]},{"food":"Animal feed","values":[3.87,3.3]},{"food":"Oil seeds","values":[0.91,0.65]}]},"srnDelay":{"sourceId":"S03","table":"UKFSR 2024 theme 3, chart data 3_2_1a","title":"Average delay on the Strategic Road Network in England","unit":"seconds per vehicle per mile","coverage":"England (National Highways' network)","months":["2015-04","2015-05","2015-06","2015-07","2015-08","2015-09","2015-10","2015-11","2015-12","2016-01","2016-02","2016-03","2016-04","2016-05","2016-06","2016-07","2016-08","2016-09","2016-10","2016-11","2016-12","2017-01","2017-02","2017-03","2017-04","2017-05","2017-06","2017-07","2017-08","2017-09","2017-10","2017-11","2017-12","2018-01","2018-02","2018-03","2018-04","2018-05","2018-06","2018-07","2018-08","2018-09","2018-10","2018-11","2018-12","2019-01","2019-02","2019-03","2019-04","2019-05","2019-06","2019-07","2019-08","2019-09","2019-10","2019-11","2019-12","2020-01","2020-02","2020-03","2020-04","2020-05","2020-06","2020-07","2020-08","2020-09","2020-10","2020-11","2020-12","2021-01","2021-02","2021-03","2021-04","2021-05","2021-06","2021-07","2021-08","2021-09","2021-10","2021-11","2021-12","2022-01","2022-02","2022-03","2022-04","2022-05","2022-06","2022-07","2022-08","2022-09","2022-10","2022-11","2022-12","2023-01","2023-02","2023-03","2023-04","2023-05","2023-06","2023-07","2023-08","2023-09","2023-10","2023-11","2023-12"],"monthly":[7.8,8.2,8.3,8.7,8.8,8.8,8.7,9.7,8.7,8.5,8.7,8.7,8.4,8.3,8.6,8.6,8.8,8.9,8.8,10.0,9.0,8.7,8.9,8.4,8.0,8.4,8.6,8.4,8.5,8.4,8.6,8.9,8.9,8.0,9.3,9.8,7.7,7.7,7.5,7.5,8.6,8.3,9.2,11.0,9.4,8.9,9.6,9.0,8.4,9.0,9.2,9.6,9.9,9.6,10.2,10.8,9.5,8.8,10.0,7.5,5.6,5.1,5.4,6.4,7.4,7.2,7.3,7.1,7.4,6.7,6.6,6.7,7.0,8.2,9.2,9.3,9.6,9.0,9.1,9.3,8.5,7.8,9.1,8.7,8.4,8.8,9.1,8.9,9.6,9.3,10.1,10.8,10.4,9.5,9.5,9.9,9.6,9.9,10.8,10.5,10.8,11.2,11.3,11.6,10.7],"yearEnding":[null,null,null,null,null,null,null,null,null,null,null,8.6,8.7,8.7,8.7,8.7,8.7,8.7,8.7,8.7,8.8,8.8,8.8,8.8,8.7,8.7,8.7,8.7,8.7,8.7,8.6,8.6,8.6,8.5,8.5,8.6,8.6,8.6,8.5,8.4,8.4,8.4,8.5,8.6,8.7,8.7,8.8,8.7,8.8,8.9,9.0,9.2,9.3,9.4,9.5,9.5,9.5,9.5,9.5,9.4,9.4,9.3,9.0,8.7,8.5,8.2,7.9,7.6,7.3,7.1,6.8,6.7,6.8,7.0,7.3,7.6,7.9,8.1,8.2,8.4,8.5,8.5,8.7,8.8,8.9,8.9,8.9,8.9,8.9,8.9,9.0,9.1,9.3,9.4,9.4,9.5,9.6,9.7,9.9,10.0,10.1,10.3,10.4,10.4,10.5]}}
